{
  "assets": {
    "public": [
      "public/output_contract.json",
      "public/result_schema.json",
      "public/sources/bid_vendor_a.pdf",
      "public/sources/bid_vendor_b.pdf",
      "public/sources/bid_vendor_c.pdf",
      "public/sources/bid_vendor_d.pdf",
      "public/sources/price_summary_cn.xlsx",
      "public/sources/scoring_policy_cn.md"
    ]
  },
  "baseline": {
    "model": "nvidia/azure/anthropic/claude-opus-4-8",
    "on_question": "continue_with_best_reversible_judgment",
    "user_availability": "unavailable_after_brief"
  },
  "domain": "procurement",
  "episode": {
    "brief": "Evaluate all four bids in sources using the supplied scoring policy. Create scorecard.csv, recommendation.md, and final.json in results. Show calculations, commercial risks, and any approval-dependent choice rather than silently treating the highest score as authority.",
    "result_paths": [
      "results/final.json",
      "results/scorecard.csv",
      "results/recommendation.md"
    ]
  },
  "runtime": {
    "cpus": 8,
    "family": "openclaw_workspace_v1",
    "memory_gb": 16,
    "modalities": [
      "text",
      "image"
    ],
    "worker_timeout_seconds": 1200
  },
  "schema_version": "1.0",
  "source": {
    "adaptation": "Kept all four bids, scoring policy, and price workbook. Added a procurement-owner decision when the numerical winner has risky terms.",
    "benchmark": "UniClawBench",
    "license": "MIT",
    "revision": "a8ac4df6c554178c339f42696e3afe688a61f4b7",
    "task_id": "task_101_24_tender_recommendation",
    "url": "https://github.com/HKU-MMLab/UniClawBench/blob/a8ac4df6c554178c339f42696e3afe688a61f4b7/tasks/task_101_24_tender_recommendation"
  },
  "summary": "Score four vendor bids from mixed procurement documents and resolve a conflict between the top quantitative bid and payment risk.",
  "task_id": "jbv1_tender_selection",
  "title": "Vendor tender recommendation with a policy exception"
}
