{
  "assets": {
    "public": [
      "public/output_contract.json",
      "public/result_schema.json",
      "public/sources/SP500.csv",
      "public/sources/var_backtest_spec.yaml",
      "public/sources/var_validation_report_draft.md"
    ]
  },
  "baseline": {
    "model": "nvidia/azure/anthropic/claude-opus-4-8",
    "on_question": "continue_with_best_reversible_judgment",
    "user_availability": "unavailable_after_brief"
  },
  "domain": "finance",
  "episode": {
    "brief": "Independently validate the 1-day 99% Historical Simulation VaR package in sources. Compute the backtest metrics from the raw CSV and specification, revise the draft into a defensible validation report with a clear model-use recommendation and monitoring conditions, and save var_validation_report.md and final.json under results.",
    "result_paths": [
      "results/final.json",
      "results/var_validation_report.md"
    ]
  },
  "runtime": {
    "cpus": 8,
    "family": "openclaw_workspace_v1",
    "memory_gb": 16,
    "modalities": [
      "text"
    ],
    "worker_timeout_seconds": 1200
  },
  "schema_version": "1.0",
  "source": {
    "adaptation": "Preserved the raw data, specification, and quantitative validation workload. Removed prior-session hidden-intent answers and introduced one risk-owner decision based on intended use.",
    "benchmark": "Pi-Bench",
    "license": "Apache-2.0",
    "revision": "383910b1698758a198b86037c63a111c8edc32ad",
    "task_id": "Financier_task_014",
    "url": "https://github.com/Simplified-Reasoning/Pi-Bench/blob/383910b1698758a198b86037c63a111c8edc32ad/data/Financier/tasks/Financier_task_014/task.yaml"
  },
  "summary": "Compute a raw historical-simulation backtest, diagnose the model, and decide whether the observed weaknesses permit the intended use.",
  "task_id": "jbv1_var_model_review",
  "title": "VaR validation and model-use decision"
}
